[
  {
    "id": 1,
    "school_id": 10,
    "teacher_code": "PRF-00001",
    "full_name": "Anacleto Aarón Gordillo Ramos",
    "national_id": "90847336G",
    "department": "Matemáticas",
    "email": "anacleto.aaron@example.org",
    "qualification": "Grado en Educación Primaria",
    "contract_type": "permanent",
    "hired_at": "2011-09-01"
  },
  {
    "id": 2,
    "school_id": 8,
    "teacher_code": "PRF-00002",
    "full_name": "Natalio Molina Donaire",
    "national_id": "89412183M",
    "department": "Ciencias Sociales",
    "email": "natalio.molina@example.org",
    "qualification": "Grado en Educación Primaria",
    "contract_type": "permanent",
    "hired_at": "2001-09-01"
  },
  {
    "id": 3,
    "school_id": 2,
    "teacher_code": "PRF-00003",
    "full_name": "Roxana de Aroca",
    "national_id": "94406890D",
    "department": "Matemáticas",
    "email": "roxana.de@example.org",
    "qualification": "Grado en Educación Primaria",
    "contract_type": "permanent",
    "hired_at": "1992-09-01"
  },
  {
    "id": 4,
    "school_id": 9,
    "teacher_code": "PRF-00004",
    "full_name": "Íngrid Mata Calatayud",
    "national_id": "16800457S",
    "department": "Formación Profesional",
    "email": "ingrid.mata@example.org",
    "qualification": "Licenciatura + CAP",
    "contract_type": "permanent",
    "hired_at": "2017-09-01"
  },
  {
    "id": 5,
    "school_id": 6,
    "teacher_code": "PRF-00005",
    "full_name": "Camilo Bravo",
    "national_id": "55451379N",
    "department": "Ciencias Sociales",
    "email": "camilo.bravo@example.org",
    "qualification": "Grado en Educación Primaria",
    "contract_type": "temporary",
    "hired_at": "1989-09-01"
  },
  {
    "id": 6,
    "school_id": 8,
    "teacher_code": "PRF-00006",
    "full_name": "Lourdes Cuenca",
    "national_id": "30751815X",
    "department": "Tecnología",
    "email": "lourdes.cuenca@example.org",
    "qualification": "Licenciatura + CAP",
    "contract_type": "interim",
    "hired_at": "1988-09-01"
  },
  {
    "id": 7,
    "school_id": 1,
    "teacher_code": "PRF-00007",
    "full_name": "Pastor Barral Río",
    "national_id": "67781001R",
    "department": "Artes",
    "email": "pastor.barral@example.org",
    "qualification": "Técnico Superior FP",
    "contract_type": "permanent",
    "hired_at": "2014-09-01"
  },
  {
    "id": 8,
    "school_id": 10,
    "teacher_code": "PRF-00008",
    "full_name": "Gonzalo Cañete Coronado",
    "national_id": "64693966A",
    "department": "Formación Profesional",
    "email": "gonzalo.canete@example.org",
    "qualification": "Doctorado",
    "contract_type": "permanent",
    "hired_at": "1999-09-01"
  },
  {
    "id": 9,
    "school_id": 8,
    "teacher_code": "PRF-00009",
    "full_name": "Josué Bernardino Villanueva Sarabia",
    "national_id": "37139744B",
    "department": "Artes",
    "email": "josue.bernardino@example.org",
    "qualification": "Grado en Educación Primaria",
    "contract_type": "permanent",
    "hired_at": "1985-09-01"
  },
  {
    "id": 10,
    "school_id": 10,
    "teacher_code": "PRF-00010",
    "full_name": "Maite Mosquera Higueras",
    "national_id": "23377464B",
    "department": "Matemáticas",
    "email": "maite.mosquera@example.org",
    "qualification": "Licenciatura + CAP",
    "contract_type": "permanent",
    "hired_at": "2010-09-01"
  },
  {
    "id": 11,
    "school_id": 10,
    "teacher_code": "PRF-00011",
    "full_name": "Azeneth Baños Reyes",
    "national_id": "71055753J",
    "department": "Ciencias Sociales",
    "email": "azeneth.banos@example.org",
    "qualification": "Grado en Educación Primaria",
    "contract_type": "permanent",
    "hired_at": "1993-09-01"
  },
  {
    "id": 12,
    "school_id": 3,
    "teacher_code": "PRF-00012",
    "full_name": "Elías Arroyo Torralba",
    "national_id": "74682063M",
    "department": "Lengua y Literatura",
    "email": "elias.arroyo@example.org",
    "qualification": "Técnico Superior FP",
    "contract_type": "interim",
    "hired_at": "2013-09-01"
  },
  {
    "id": 13,
    "school_id": 10,
    "teacher_code": "PRF-00013",
    "full_name": "Serafina Ballesteros Grande",
    "national_id": "54464508W",
    "department": "Orientación",
    "email": "serafina.ballesteros@example.org",
    "qualification": "Grado en Educación Primaria",
    "contract_type": "interim",
    "hired_at": "1994-09-01"
  },
  {
    "id": 14,
    "school_id": 10,
    "teacher_code": "PRF-00014",
    "full_name": "Fito Barrio Romero",
    "national_id": "54521852F",
    "department": "Artes",
    "email": "fito.barrio@example.org",
    "qualification": "Grado en Educación Primaria",
    "contract_type": "temporary",
    "hired_at": "2009-09-01"
  },
  {
    "id": 15,
    "school_id": 1,
    "teacher_code": "PRF-00015",
    "full_name": "Águeda Caro Sevilla",
    "national_id": "84259068V",
    "department": "Educación Física",
    "email": "agueda.caro@example.org",
    "qualification": "Grado + Máster en Formación del Profesorado",
    "contract_type": "interim",
    "hired_at": "2020-09-01"
  },
  {
    "id": 16,
    "school_id": 9,
    "teacher_code": "PRF-00016",
    "full_name": "Jacinto Ramón-Blasco",
    "national_id": "89696310J",
    "department": "Idiomas",
    "email": "jacinto.ramon-blasco@example.org",
    "qualification": "Grado en Educación Primaria",
    "contract_type": "interim",
    "hired_at": "1998-09-01"
  },
  {
    "id": 17,
    "school_id": 3,
    "teacher_code": "PRF-00017",
    "full_name": "Victoria Clara Moliner González",
    "national_id": "04352515H",
    "department": "Artes",
    "email": "victoria.clara@example.org",
    "qualification": "Licenciatura + CAP",
    "contract_type": "permanent",
    "hired_at": "2011-09-01"
  },
  {
    "id": 18,
    "school_id": 5,
    "teacher_code": "PRF-00018",
    "full_name": "Samu del Arco",
    "national_id": "16753077S",
    "department": "Educación Física",
    "email": "samu.del@example.org",
    "qualification": "Grado + Máster en Formación del Profesorado",
    "contract_type": "permanent",
    "hired_at": "2023-09-01"
  },
  {
    "id": 19,
    "school_id": 4,
    "teacher_code": "PRF-00019",
    "full_name": "Aránzazu Sobrino Dávila",
    "national_id": "65742049E",
    "department": "Artes",
    "email": "aranzazu.sobrino@example.org",
    "qualification": "Grado en Educación Primaria",
    "contract_type": "temporary",
    "hired_at": "1991-09-01"
  },
  {
    "id": 20,
    "school_id": 2,
    "teacher_code": "PRF-00020",
    "full_name": "Adoración Lloret Samper",
    "national_id": "23632719N",
    "department": "Ciencias Sociales",
    "email": "adoracion.lloret@example.org",
    "qualification": "Licenciatura + CAP",
    "contract_type": "permanent",
    "hired_at": "1997-09-01"
  },
  {
    "id": 21,
    "school_id": 1,
    "teacher_code": "PRF-00021",
    "full_name": "Inmaculada Canales Bernat",
    "national_id": "98629317G",
    "department": "Tecnología",
    "email": "inmaculada.canales@example.org",
    "qualification": "Grado en Educación Primaria",
    "contract_type": "interim",
    "hired_at": "1990-09-01"
  },
  {
    "id": 22,
    "school_id": 7,
    "teacher_code": "PRF-00022",
    "full_name": "Reyes Gisela Dávila Baena",
    "national_id": "30075609G",
    "department": "Educación Física",
    "email": "reyes.gisela@example.org",
    "qualification": "Grado en Educación Primaria",
    "contract_type": "temporary",
    "hired_at": "2020-09-01"
  },
  {
    "id": 23,
    "school_id": 10,
    "teacher_code": "PRF-00023",
    "full_name": "Emiliana Patiño Reina",
    "national_id": "89626960P",
    "department": "Tecnología",
    "email": "emiliana.patino@example.org",
    "qualification": "Grado + Máster en Formación del Profesorado",
    "contract_type": "temporary",
    "hired_at": "1998-09-01"
  },
  {
    "id": 24,
    "school_id": 9,
    "teacher_code": "PRF-00024",
    "full_name": "Beatriz Casares Ávila",
    "national_id": "04180171J",
    "department": "Formación Profesional",
    "email": "beatriz.casares@example.org",
    "qualification": "Grado en Educación Primaria",
    "contract_type": "interim",
    "hired_at": "1999-09-01"
  },
  {
    "id": 25,
    "school_id": 8,
    "teacher_code": "PRF-00025",
    "full_name": "Concha Quintero Diego",
    "national_id": "79604127T",
    "department": "Artes",
    "email": "concha.quintero@example.org",
    "qualification": "Técnico Superior FP",
    "contract_type": "temporary",
    "hired_at": "1993-09-01"
  },
  {
    "id": 26,
    "school_id": 2,
    "teacher_code": "PRF-00026",
    "full_name": "Manu de Toledo",
    "national_id": "53530897F",
    "department": "Formación Profesional",
    "email": "manu.de@example.org",
    "qualification": "Grado + Máster en Formación del Profesorado",
    "contract_type": "permanent",
    "hired_at": "2024-09-01"
  },
  {
    "id": 27,
    "school_id": 1,
    "teacher_code": "PRF-00027",
    "full_name": "Noemí María Belén Cabello Villegas",
    "national_id": "92203192X",
    "department": "Ciencias Sociales",
    "email": "noemi.maria@example.org",
    "qualification": "Grado en Educación Primaria",
    "contract_type": "interim",
    "hired_at": "1993-09-01"
  },
  {
    "id": 28,
    "school_id": 7,
    "teacher_code": "PRF-00028",
    "full_name": "Graciela Mate Múgica",
    "national_id": "61146325C",
    "department": "Ciencias",
    "email": "graciela.mate@example.org",
    "qualification": "Licenciatura + CAP",
    "contract_type": "permanent",
    "hired_at": "2022-09-01"
  },
  {
    "id": 29,
    "school_id": 1,
    "teacher_code": "PRF-00029",
    "full_name": "Leonardo Bruno Gimeno Piñeiro",
    "national_id": "83997384G",
    "department": "Ciencias Sociales",
    "email": "leonardo.bruno@example.org",
    "qualification": "Técnico Superior FP",
    "contract_type": "permanent",
    "hired_at": "2013-09-01"
  },
  {
    "id": 30,
    "school_id": 8,
    "teacher_code": "PRF-00030",
    "full_name": "Trini Seco",